{
  "schema_version": 1,
  "record_id": "LIT-0215EC756CB8",
  "project_id": "jds-3d-reconstruction",
  "status": "needs-review",
  "bibliographic": {
    "title": "RealityAvatar: Towards Realistic Loose Clothing Modeling in Animatable 3D Gaussian Avatars",
    "authors": [
      {
        "name": "Yahui Li",
        "orcid": null
      },
      {
        "name": "Zhi Zeng",
        "orcid": null
      },
      {
        "name": "Liming Pang",
        "orcid": null
      },
      {
        "name": "Guixuan Zhang",
        "orcid": null
      },
      {
        "name": "Shuwu Zhang",
        "orcid": null
      }
    ],
    "year": 2025,
    "publication_date": "2025-04-02T09:59:12Z",
    "venue": "arXiv",
    "publisher": "arXiv",
    "type": "preprint",
    "language": null,
    "abstract": "Modeling animatable human avatars from monocular or multi-view videos has been widely studied, with recent approaches leveraging neural radiance fields (NeRFs) or 3D Gaussian Splatting (3DGS) achieving impressive results in novel-view and novel-pose synthesis. However, existing methods often struggle to accurately capture the dynamics of loose clothing, as they primarily rely on global pose conditioning or static per-frame representations, leading to oversmoothing and temporal inconsistencies in non-rigid regions. To address this, We propose RealityAvatar, an efficient framework for high-fidelity digital human modeling, specifically targeting loosely dressed avatars. Our method leverages 3D Gaussian Splatting to capture complex clothing deformations and motion dynamics while ensuring geometric consistency. By incorporating a motion trend module and a latentbone encoder, we explicitly model pose-dependent deformations and temporal variations in clothing behavior. Extensive experiments on benchmark datasets demonstrate the effectiveness of our approach in capturing fine-grained clothing deformations and motion-driven shape variations. Our method significantly enhances structural fidelity and perceptual quality in dynamic human reconstruction, particularly in non-rigid regions, while achieving better consistency across temporal frames.",
    "topics": [
      "cs.CV"
    ],
    "citation_count": null
  },
  "external_ids": {
    "doi": null,
    "openalex": null,
    "arxiv": "2504.01559",
    "pmid": null,
    "zotero": null
  },
  "access": {
    "canonical_url": "https://arxiv.org/abs/2504.01559",
    "open_access_url": "https://arxiv.org/pdf/2504.01559v1",
    "fulltext_urls": [
      "https://arxiv.org/pdf/2504.01559v1"
    ],
    "license_urls": []
  },
  "provenance": {
    "input": "arXiv:2504.01559",
    "canonical_identity": "arxiv:2504.01559",
    "retrievals": [
      {
        "source": "arxiv",
        "url": "https://export.arxiv.org/api/query?id_list=2504.01559",
        "retrieved_at": "2026-08-23T05:16:48Z"
      }
    ],
    "review_warnings": []
  },
  "review": {
    "relevance": "unreviewed",
    "source_inspected": "metadata-only",
    "key_findings": [],
    "methods": [],
    "limitations": [],
    "reviewed_by": null,
    "reviewed_at": null
  },
  "traceability": {
    "idea_ids": [],
    "experiment_ids": [],
    "claim_ids": [],
    "figure_ids": [],
    "table_ids": []
  },
  "created_at": "2026-08-23T05:16:48Z",
  "updated_at": "2026-08-23T05:16:48Z"
}
