{
  "schema_version": 1,
  "record_id": "LIT-B36B0F75FBEA",
  "project_id": "jds-3d-reconstruction",
  "status": "needs-review",
  "bibliographic": {
    "title": "ReLoo: Reconstructing Humans Dressed in Loose Garments from Monocular Video in the Wild",
    "authors": [
      {
        "name": "Chen Guo",
        "orcid": null
      },
      {
        "name": "Tianjian Jiang",
        "orcid": null
      },
      {
        "name": "Manuel Kaufmann",
        "orcid": null
      },
      {
        "name": "Chengwei Zheng",
        "orcid": null
      },
      {
        "name": "Julien Valentin",
        "orcid": null
      },
      {
        "name": "Jie Song",
        "orcid": null
      },
      {
        "name": "Otmar Hilliges",
        "orcid": null
      }
    ],
    "year": 2024,
    "publication_date": "2024-09-23T17:58:39Z",
    "venue": "arXiv",
    "publisher": "arXiv",
    "type": "preprint",
    "language": null,
    "abstract": "While previous years have seen great progress in the 3D reconstruction of humans from monocular videos, few of the state-of-the-art methods are able to handle loose garments that exhibit large non-rigid surface deformations during articulation. This limits the application of such methods to humans that are dressed in standard pants or T-shirts. Our method, ReLoo, overcomes this limitation and reconstructs high-quality 3D models of humans dressed in loose garments from monocular in-the-wild videos. To tackle this problem, we first establish a layered neural human representation that decomposes clothed humans into a neural inner body and outer clothing. On top of the layered neural representation, we further introduce a non-hierarchical virtual bone deformation module for the clothing layer that can freely move, which allows the accurate recovery of non-rigidly deforming loose clothing. A global optimization jointly optimizes the shape, appearance, and deformations of the human body and clothing via multi-layer differentiable volume rendering. To evaluate ReLoo, we record subjects with dynamically deforming garments in a multi-view capture studio. This evaluation, both on existing and our novel dataset, demonstrates ReLoo's clear superiority over prior art on both indoor datasets and in-the-wild videos.",
    "topics": [
      "cs.CV"
    ],
    "citation_count": null
  },
  "external_ids": {
    "doi": null,
    "openalex": null,
    "arxiv": "2409.15269",
    "pmid": null,
    "zotero": null
  },
  "access": {
    "canonical_url": "https://arxiv.org/abs/2409.15269",
    "open_access_url": "https://arxiv.org/pdf/2409.15269v2",
    "fulltext_urls": [
      "https://arxiv.org/pdf/2409.15269v2"
    ],
    "license_urls": []
  },
  "provenance": {
    "input": "arXiv:2409.15269",
    "canonical_identity": "arxiv:2409.15269",
    "retrievals": [
      {
        "source": "arxiv",
        "url": "https://export.arxiv.org/api/query?id_list=2409.15269",
        "retrieved_at": "2026-08-23T05:16:46Z"
      }
    ],
    "review_warnings": []
  },
  "review": {
    "relevance": "unreviewed",
    "source_inspected": "metadata-only",
    "key_findings": [],
    "methods": [],
    "limitations": [],
    "reviewed_by": null,
    "reviewed_at": null
  },
  "traceability": {
    "idea_ids": [],
    "experiment_ids": [],
    "claim_ids": [],
    "figure_ids": [],
    "table_ids": []
  },
  "created_at": "2026-08-23T05:16:46Z",
  "updated_at": "2026-08-23T05:16:46Z"
}
