{
  "schema_version": 1,
  "record_id": "LIT-537AC4BD205F",
  "project_id": "jds-3d-reconstruction",
  "status": "screened",
  "bibliographic": {
    "title": "LightSim: Neural Lighting Simulation for Urban Scenes",
    "authors": [
      {
        "name": "Ava Pun",
        "orcid": null
      },
      {
        "name": "Gary Sun",
        "orcid": null
      },
      {
        "name": "Jingkang Wang",
        "orcid": null
      },
      {
        "name": "Yun Chen",
        "orcid": null
      },
      {
        "name": "Ze Yang",
        "orcid": null
      },
      {
        "name": "Sivabalan Manivasagam",
        "orcid": null
      },
      {
        "name": "Wei-Chiu Ma",
        "orcid": null
      },
      {
        "name": "Raquel Urtasun",
        "orcid": null
      }
    ],
    "year": 2023,
    "publication_date": "2023-12-11T18:59:13Z",
    "venue": "arXiv",
    "publisher": "arXiv",
    "type": "preprint",
    "language": null,
    "abstract": "Different outdoor illumination conditions drastically alter the appearance of urban scenes, and they can harm the performance of image-based robot perception systems if not seen during training. Camera simulation provides a cost-effective solution to create a large dataset of images captured under different lighting conditions. Towards this goal, we propose LightSim, a neural lighting camera simulation system that enables diverse, realistic, and controllable data generation. LightSim automatically builds lighting-aware digital twins at scale from collected raw sensor data and decomposes the scene into dynamic actors and static background with accurate geometry, appearance, and estimated scene lighting. These digital twins enable actor insertion, modification, removal, and rendering from a new viewpoint, all in a lighting-aware manner. LightSim then combines physically-based and learnable deferred rendering to perform realistic relighting of modified scenes, such as altering the sun location and modifying the shadows or changing the sun brightness, producing spatially- and temporally-consistent camera videos. Our experiments show that LightSim generates more realistic relighting results than prior work. Importantly, training perception models on data generated by LightSim can significantly improve their performance.",
    "topics": [
      "cs.CV",
      "cs.LG"
    ],
    "citation_count": null
  },
  "external_ids": {
    "doi": null,
    "openalex": null,
    "arxiv": "2312.06654",
    "pmid": null,
    "zotero": null
  },
  "access": {
    "canonical_url": "https://arxiv.org/abs/2312.06654",
    "open_access_url": "https://arxiv.org/pdf/2312.06654v1",
    "fulltext_urls": [
      "https://arxiv.org/pdf/2312.06654v1"
    ],
    "license_urls": []
  },
  "provenance": {
    "input": "2312.06654",
    "canonical_identity": "arxiv:2312.06654",
    "retrievals": [
      {
        "source": "arxiv",
        "url": "https://export.arxiv.org/api/query?id_list=2312.06654",
        "retrieved_at": "2026-08-18T08:50:20Z"
      },
      {
        "source": "arxiv",
        "url": "https://export.arxiv.org/api/query?id_list=2312.06654",
        "retrieved_at": "2026-08-18T08:57:17Z"
      }
    ],
    "review_warnings": []
  },
  "review": {
    "relevance": "direct-competitor-highest-priority",
    "source_inspected": "abstract-and-full-text-sections",
    "key_findings": [
      "已覆盖驾驶场景动态 actor/静态背景分解、对象编辑、太阳与阴影重打光和时序视频。"
    ],
    "methods": [
      "物理渲染与学习式 deferred renderer；真实/合成 paired-light 训练。"
    ],
    "limitations": [
      "原始阴影可能烘焙进重建；固定材质；夜间局部光源处理受限。"
    ],
    "reviewed_by": "Codex",
    "reviewed_at": "2026-08-18T00:00:00Z"
  },
  "traceability": {
    "idea_ids": [
      "IDEA-DC38D8C3CC41",
      "IDEA-132F2E720420"
    ],
    "experiment_ids": [
      "EXP-C4E8F5217892",
      "EXP-4C2A9AD4C3D2"
    ],
    "claim_ids": [],
    "figure_ids": [],
    "table_ids": []
  },
  "created_at": "2026-08-18T08:50:20Z",
  "updated_at": "2026-08-18T08:57:17Z"
}
