{
  "schema_version": 1,
  "record_id": "LIT-6BE73BA19078",
  "project_id": "jds-3d-reconstruction",
  "status": "screened",
  "bibliographic": {
    "title": "DrivingGaussian++: Towards Realistic Reconstruction and Editable Simulation for Surrounding Dynamic Driving Scenes",
    "authors": [
      {
        "name": "Yajiao Xiong",
        "orcid": null
      },
      {
        "name": "Xiaoyu Zhou",
        "orcid": null
      },
      {
        "name": "Yongtao Wan",
        "orcid": null
      },
      {
        "name": "Deqing Sun",
        "orcid": null
      },
      {
        "name": "Ming-Hsuan Yang",
        "orcid": null
      }
    ],
    "year": 2025,
    "publication_date": "2025-08-28T16:22:54Z",
    "venue": "arXiv",
    "publisher": "arXiv",
    "type": "preprint",
    "language": null,
    "abstract": "We present DrivingGaussian++, an efficient and effective framework for realistic reconstructing and controllable editing of surrounding dynamic autonomous driving scenes. DrivingGaussian++ models the static background using incremental 3D Gaussians and reconstructs moving objects with a composite dynamic Gaussian graph, ensuring accurate positions and occlusions. By integrating a LiDAR prior, it achieves detailed and consistent scene reconstruction, outperforming existing methods in dynamic scene reconstruction and photorealistic surround-view synthesis. DrivingGaussian++ supports training-free controllable editing for dynamic driving scenes, including texture modification, weather simulation, and object manipulation, leveraging multi-view images and depth priors. By integrating large language models (LLMs) and controllable editing, our method can automatically generate dynamic object motion trajectories and enhance their realism during the optimization process. DrivingGaussian++ demonstrates consistent and realistic editing results and generates dynamic multi-view driving scenarios, while significantly enhancing scene diversity. More results and code can be found at the project site: https://xiong-creator.github.io/DrivingGaussian_plus.github.io",
    "topics": [
      "cs.CV"
    ],
    "citation_count": null
  },
  "external_ids": {
    "doi": null,
    "openalex": null,
    "arxiv": "2508.20965",
    "pmid": null,
    "zotero": null
  },
  "access": {
    "canonical_url": "https://arxiv.org/abs/2508.20965",
    "open_access_url": "https://arxiv.org/pdf/2508.20965v1",
    "fulltext_urls": [
      "https://arxiv.org/pdf/2508.20965v1"
    ],
    "license_urls": []
  },
  "provenance": {
    "input": "2508.20965",
    "canonical_identity": "arxiv:2508.20965",
    "retrievals": [
      {
        "source": "arxiv",
        "url": "https://export.arxiv.org/api/query?id_list=2508.20965",
        "retrieved_at": "2026-08-18T08:50:20Z"
      },
      {
        "source": "arxiv",
        "url": "https://export.arxiv.org/api/query?id_list=2508.20965",
        "retrieved_at": "2026-08-18T08:57:18Z"
      }
    ],
    "review_warnings": []
  },
  "review": {
    "relevance": "direct-competitor-system",
    "source_inspected": "abstract-and-project-page",
    "key_findings": [
      "LiDAR 驱动静态背景/动态对象 Gaussian graph，支持 training-free 对象、纹理与天气编辑。"
    ],
    "methods": [
      "incremental static Gaussians；composite dynamic Gaussian graph。"
    ],
    "limitations": [
      "摘要中的天气/纹理编辑不证明材质—光照分解或投影阴影正确。"
    ],
    "reviewed_by": "Codex",
    "reviewed_at": "2026-08-18T00:00:00Z"
  },
  "traceability": {
    "idea_ids": [
      "IDEA-93F257E3E556"
    ],
    "experiment_ids": [
      "EXP-1584B0636795",
      "EXP-4C2A9AD4C3D2"
    ],
    "claim_ids": [],
    "figure_ids": [],
    "table_ids": []
  },
  "created_at": "2026-08-18T08:50:20Z",
  "updated_at": "2026-08-18T08:57:18Z"
}
