{
  "schema_version": 1,
  "record_id": "LIT-3E7D80D87C6C",
  "project_id": "jds-3d-reconstruction",
  "status": "screened",
  "bibliographic": {
    "title": "GS-ID: Illumination Decomposition on Gaussian Splatting via Adaptive Light Aggregation and Diffusion-Guided Material Priors",
    "authors": [
      {
        "name": "Kang Du",
        "orcid": null
      },
      {
        "name": "Zhihao Liang",
        "orcid": null
      },
      {
        "name": "Yulin Shen",
        "orcid": null
      },
      {
        "name": "Zeyu Wang",
        "orcid": null
      }
    ],
    "year": 2024,
    "publication_date": "2024-08-16T04:38:31Z",
    "venue": "arXiv",
    "publisher": "arXiv",
    "type": "preprint",
    "language": null,
    "abstract": "Gaussian Splatting (GS) has emerged as an effective representation for photorealistic rendering, but the underlying geometry, material, and lighting remain entangled, hindering scene editing. Existing GS-based methods struggle to disentangle these components under non-Lambertian conditions, especially in the presence of specularities and shadows. We propose \\textbf{GS-ID}, an end-to-end framework for illumination decomposition that integrates adaptive light aggregation with diffusion-based material priors. In addition to a learnable environment map for ambient illumination, we model spatially-varying local lighting using anisotropic spherical Gaussian mixtures (SGMs) that are jointly optimized with scene content. To better capture cast shadows, we associate each splat with a learnable unit vector that encodes shadow directions from multiple light sources, further improving material and lighting estimation. By combining SGMs with intrinsic priors from diffusion models, GS-ID significantly reduces ambiguity in light-material-geometry interactions and achieves state-of-the-art performance on inverse rendering and relighting benchmarks. Experiments also demonstrate the effectiveness of GS-ID for downstream applications such as relighting and scene composition.",
    "topics": [
      "cs.AI",
      "cs.CV"
    ],
    "citation_count": null
  },
  "external_ids": {
    "doi": null,
    "openalex": null,
    "arxiv": "2408.08524",
    "pmid": null,
    "zotero": null
  },
  "access": {
    "canonical_url": "https://arxiv.org/abs/2408.08524",
    "open_access_url": "https://arxiv.org/pdf/2408.08524v2",
    "fulltext_urls": [
      "https://arxiv.org/pdf/2408.08524v2"
    ],
    "license_urls": []
  },
  "provenance": {
    "input": "2408.08524",
    "canonical_identity": "arxiv:2408.08524",
    "retrievals": [
      {
        "source": "arxiv",
        "url": "https://export.arxiv.org/api/query?id_list=2408.08524",
        "retrieved_at": "2026-08-18T08:50:20Z"
      },
      {
        "source": "arxiv",
        "url": "https://export.arxiv.org/api/query?id_list=2408.08524",
        "retrieved_at": "2026-08-18T08:57:18Z"
      }
    ],
    "review_warnings": []
  },
  "review": {
    "relevance": "direct-competitor-relighting-method",
    "source_inspected": "abstract-and-project-page",
    "key_findings": [
      "environment map、空间变化 SGM lights、diffusion material priors 和 per-splat shadow direction 与原 FastRelight 草案高度重叠。"
    ],
    "methods": [
      "joint inverse rendering；adaptive light aggregation；material priors。"
    ],
    "limitations": [
      "非驾驶动态 4D 系统；per-scene optimization。"
    ],
    "reviewed_by": "Codex",
    "reviewed_at": "2026-08-18T00:00:00Z"
  },
  "traceability": {
    "idea_ids": [
      "IDEA-DC38D8C3CC41"
    ],
    "experiment_ids": [
      "EXP-C4E8F5217892",
      "EXP-4C2A9AD4C3D2"
    ],
    "claim_ids": [],
    "figure_ids": [],
    "table_ids": []
  },
  "created_at": "2026-08-18T08:50:20Z",
  "updated_at": "2026-08-18T08:57:18Z"
}
